{
  "schemaVersion": 1,
  "observedAt": "2027-01-15T08:00:00.000Z",
  "source": "opencodex-local-snapshot",
  "refreshIntervalSeconds": 10,
  "warnings": [],
  "providers": [
    {
      "id": "openai",
      "name": "OpenAI",
      "enabled": true,
      "defaultModel": "gpt-5.4",
      "supportedModels": ["gpt-5.4", "gpt-oss:120b"],
      "accounts": [
        {
          "id": "__main__",
          "label": "Codex 기본 계정",
          "plan": "pro",
          "status": "ok",
          "updatedAt": "2027-01-15T08:00:00.000Z",
          "active": false,
          "windows": [
            {
              "id": "weekly",
              "label": "주간",
              "remainingPercent": 0,
              "stale": false,
              "resetAt": "2027-01-15T09:00:00.000Z",
              "usageScope": "all",
              "analytics": {
                "providerWide": true,
                "consumptionPeriods": {
                  "twentyFourHour": { "deltaPp": 100, "spanHours": 24, "coverage": 1, "basis": "observed-increase" }
                }
              }
            }
          ]
        }
      ]
    },
    {
      "id": "anthropic",
      "name": "Anthropic",
      "enabled": true,
      "defaultModel": null,
      "supportedModels": ["claude-opus-5"],
      "accounts": [
        {
          "id": "a1",
          "label": "계정 1",
          "plan": null,
          "status": "ok",
          "updatedAt": "2027-01-15T08:00:00.000Z",
          "windows": [
            {
              "id": "five-hour",
              "label": "5시간",
              "remainingPercent": 100,
              "stale": false,
              "resetAt": null,
              "usageScope": null
            }
          ]
        }
      ],
      "analytics": {
        "modelPrices": [
          {
            "model": "claude-opus-5",
            "status": "official",
            "unit": "usd-per-million-tokens",
            "rates": { "input": 5, "output": 25, "cacheRead": 0.5, "cacheWrite": 6.25 },
            "sourceUrl": "https://platform.claude.com/docs/en/about-claude/pricing",
            "checkedAt": "2026-09-10",
            "effectiveFrom": null,
            "effectiveTo": null,
            "conditions": ["cache-write-assumed"],
            "unsupported": [],
            "conflict": null,
            "reason": null
          },
          {
            "model": "never-published-model",
            "status": "unpriced",
            "unit": "usd-per-million-tokens",
            "rates": { "input": null, "output": null, "cacheRead": null, "cacheWrite": null },
            "sourceUrl": null,
            "checkedAt": null,
            "effectiveFrom": null,
            "effectiveTo": null,
            "conditions": [],
            "unsupported": ["cache-write"],
            "conflict": null,
            "reason": "모델 단가 미확인"
          }
        ]
      }
    }
  ]
}
